发布时间,转发数,评论数,收藏数,点赞数,动态内容
2018-04-28 06:59:36,0,0,0,6,其他详细指数及因子的估值及景气度见果仁网站：网页链接，用我的邀请码：AAHGQ注册后直接送一个月VIP。更多文章关注我的公众号：持有封基
2018-04-27 17:12:59,1,12,1,18,市场就是一个神经病，本周5天是这样度过的：周一大强小弱，周二大小齐涨，周三大弱小强，周四大小齐跌；周五又变成大弱小强了，如果天天追风格天天吃套。
2018-04-27 05:23:42,1,6,1,9,昨天格力因不分红导致格力带领白马蓝筹大跌，今天估计剧情要反转了。其他详细指数及因子的估值及景气度见果仁网站：网页链接，用我的邀请码：AAHGQ注册后直接送一个月VIP。更多文章关注我的公众号：持有封基
2018-04-26 15:17:08,0,6,1,8,今天格力带领大盘一起下跌，格力放出了171.2亿的天量，虽然明天格力还可能惯性下跌，今天晚上公布季报，看季报是否有什么影响：
2018-04-26 10:35:36,2,22,3,15,$格力电器(SZ000651)$&nbsp;今天的行情是格力带着大盘往下跑，一个小时成交了100亿，难道今天会成交400亿？这个天量是历史上空前的！即使这样的天量，都没触及跌停，说明大家对不分红的看法还是多空都有。
2018-04-26 07:38:14,6,27,4,30,$格力电器(SZ000651)$&nbsp;昨天格力年报一公布不分红，网上一片口诛笔伐。格力上市以来除了2006年外，这是第二次。董明珠自己持有4000多万股，她自己都不急着分红，我们急什么。业绩再好都没用，今天开盘肯定大跌。但我不会抛出一股。济川药业一季度季报利润同比增加60%，结果第一天都大跌，但后来两天大涨而且还创了历史新高。相信格力也会有新高的那一天的。
2018-04-26 07:26:46,0,0,1,4,其他详细指数及因子的估值及景气度见果仁网站：网页链接，用我的邀请码：AAHGQ注册后直接送一个月VIP。更多文章关注我的公众号：持有封基
2018-04-25 15:43:58,2,24,1,14,$格力电器(SZ000651)$&nbsp;今天等年报，明天等季报，鸡冻啊
2018-04-25 15:26:08,1,10,1,15,前天是大强小弱，昨天是大小齐涨，今天又变成大弱小强了。风格一天一个样，如果你去追这个风格，十有八九要被左右打脸： 
2018-04-25 05:47:46,0,5,0,6,其他详细指数及因子的估值及景气度见果仁网站：网页链接，用我的邀请码：AAHGQ注册后直接送一个月VIP。更多文章关注我的公众号：持有封基
2018-04-24 15:19:58,3,13,5,15,降准利好也不如政治局会议史无前例的提及了股市，而且排在债市、汇市、楼市前，在中国做任何事情都要懂政治： 
2018-04-24 11:27:56,3,10,1,29,今天的大幅度反弹，从表面上看是中央政治局会议提及股市利好，但其估值确实也是很低了。前几天港资源源不断的买入正好给他们抄底抄个正着。被收割的小散们又在底下骂娘了。
2018-04-24 08:18:53,4,14,4,15,央行定向降低存款准备金，为什么现在那么缺钱？昨天的国债逆回购204001，最后一笔成交价竟然从4.55%飙升到8.77%，上周5最高到年化18%。股市也是一路跌跌不休。除了其他原因外，还有一个导致最近资金紧张的原因竟然是企业的盈利在提升！因为盈利提升，所以要交的税多了，而4月份又是一个交税的关键时点。
2018-04-24 05:40:13,1,0,1,9,其他详细指数及因子的估值及景气度见果仁网站：网页链接，用我的邀请码：AAHGQ注册后直接送一个月VIP
2018-04-23 21:00:20,2,20,9,15,今天是明星基金兴全合宜（163417）上市第一天，没想到的是场内交易收盘暴跌7.52%，中间触及跌停。为什么会出现这种情况呢？首先兴全合宜是一个封闭两年的场外基金，也就是说2年内你不得向基金公司赎回。那么为什么基金公司要封闭2年呢？那是因为如果是普通的开放基金，基金经理的操作很容易被基民绑架，比如说在基金经理判断大盘快见底时，因为基民的恐慌，导致赎回大量增多，而基金又不可能放大量的现金等待基民赎回，所以基民赎回多了，基金的少量现金无法应付赎回，只能在底部割肉。同样在股市顶部时也因为大量基民看好导致大量现金涌入而不得不在顶部买入股票，这样的结果就使得基金的业绩差强人意。所以这次兴全在发行兴全合宜时采用了封闭两年的方法。 那么如果真的基民要用钱怎么办？你在两年内无法赎回给基金公司，但可以像股票那么在场内交易，而代价就是折价。当然今天的暴跌，还有一个原因是因为兴全合宜持有的中兴通讯导致的，根据最新公告，兴全合宜持有中兴通讯1.63%，即使跌去50%，也只有影响了0.81%，所以今天的大跌，主要还是因为封闭期较长，再加上对中兴通讯的恐慌导致的，等晚上净值公布后才知道今天究竟跌了多少，再大跌都不可能净值跌7.52%的。
2018-04-23 15:19:37,0,6,1,7,今天再次出现大强小弱的局面。港资继续源源不断的净买入，今天北上24亿多，南下反而流出8亿多。最近北上流入南下流出的局面是过去不常见的，估计和6月份的MSCI有关：
2018-04-23 13:45:50,3,15,9,19,$辉丰转债(SZ128012)$&nbsp;辉丰转债（128012）因正股跌停大跌7.38%，创出历史新低。还有4年到期的辉丰转债现在的到期收益率已经高达5.31%（税后4.96%）。可转债因为今年大量上市，价格中枢在不断下降，保护垫越来越弱，现在还不是抄底的时候。
2018-04-23 07:49:54,2,15,1,12,网上一片看空声，看看这些标题就知道了：《跌穿3000点仅是开胃菜》、《2018年A股面临两大风险》、《下周看沪指大盘正式破位》、《熊市里往往会是黑周一》、《下周还有血雨腥风的大动作》、《大盘调整能否一步到位》
2018-04-22 17:02:51,2,26,2,7,$济川药业(SH600566)$&nbsp; 济川药业一季度归母净利润同比增加了60%多，导致PE(TTM)从33.67一下子下降到28，历史上最低PE是24，明天高开是必须的：
2018-04-21 18:29:17,1,26,1,13,$海康威视(SZ002415)$&nbsp;我算了一下，海康的PE（ttm）因年报和一季度季报的公布，将从40.54一下子下降到36.3，这个PE将回到去年8月份的水平。不断稳定提高的利润，是维持估值的保证。
2018-04-20 15:22:27,3,11,3,10,几乎所有的板块均下跌，88%多的个股下跌，下跌均值和中位数都超过2.3%，而且全部超过所有指数，说明今天小票跌的厉害。
2018-04-20 06:10:48,0,3,2,8,从ROE看，还是白酒、食品、医药等居前，能源、军工等居后其他详细指数及因子的估值及景气度见果仁网站：网页链接，用我的邀请码：AAHGQ注册后直接送一个月VIP
2018-04-19 17:59:16,4,19,6,27,今天我过去的一个老同事告诉我，15年5月在银行买了80万交银荣和保本（519753），问我怎么会亏的，我一看昨天的净值是1.014，她是净值是1的时候申购的，怎么会亏呢？我后来仔细帮她看了一下，超过2年赎回是免费，关键是出在这个申购费上，她去银行申购这个产品，标准1.5%的申购费，就直接扣了11750.66元，所以只有788249.34的份额，按照昨天的净值1.014计算，现在的价值是799284.8，正好亏了715.2元 。银行都是按照最高的标准费用收费的，现在各大平台只有1折。而且给你推荐的产品，都是他们理财经理提成最高的，问她为什么要去买这个申购费那么高的产品，她说相信银行。所以这个银行的金字招牌是值钱。
2018-04-19 15:20:51,1,10,0,9,看着港资连续每天好几十亿的涌入，估计陆资也坐不住开始做多了。今天又是家电、酿酒、煤炭、有色等熟悉的味道来了：
2018-04-19 11:58:04,0,14,2,23,今天上午北上资金净买入近40亿，昨天是创纪录的73亿。最近一段时间不管A股涨跌北上的港资就是一个字：买买买。昨天海康威视在底部成交了33亿，其中17亿是港资买的，结果硬生生从跌近4%翻红，今天海康威视上午又是大涨3.55%。MSCI快来了，港资或者说借港资通道的外资在A股下跌小散割肉时慢慢在吸筹。
2018-04-19 06:54:39,0,0,0,3,其他详细指数及因子的估值及景气度见果仁网站：网页链接，用我的邀请码：AAHGQ注册后直接送一个月VIP
2018-04-18 15:23:53,2,35,2,20,大家都猜高开低走，上午似乎和大家猜的一样，偏偏下午开始走出一个大V字，这是几乎没人猜到的。股市的魅力就在于此：永远像一本天书，谁的猜不透，今天的3041.63，说不定就是今年的底部了： 
2018-04-18 07:59:52,3,48,0,26,那么多人相信今天高开低走，逢高减仓，我估计这个事情要黄了。
2018-04-18 06:40:09,0,0,4,5,其他详细指数及因子的估值及景气度见果仁网站：网页链接，用我的邀请码：AAHGQ注册后直接送一个月VIP
2018-04-17 15:25:47,2,6,2,17,今天创业板跌的比50更多，比较搞笑的是患难三兄弟的乐视网涨停，保千里、獐子岛红盘。想到下跌，没想到跌这么多，更没想到这烂票三兄弟竟然全红： 
2018-04-17 13:31:10,7,29,1,51,大盘跌的惨不忍睹，但乐视网涨停，保千里、獐子岛都是红盘，这就是中国股市的现状。
2018-04-17 07:59:41,0,0,2,6,其他详细指数及因子的估值及景气度见果仁网站：网页链接，用我的邀请码：AAHGQ注册后直接送一个月VIP
2018-04-16 15:23:05,3,17,2,13,今天交易的24只海南板块全红，其中21只涨停。再次出现去年的雄安走势。追进去的小散不长记性，去年雄安板块的很多股票一直套到现在，华夏幸福今天还跌停了： 
2018-04-14 06:24:01,0,2,1,8,其他详细指数及因子的估值及景气度见果仁网站：网页链接，用我的邀请码：AAHGQ注册后直接送一个月VIP
2018-04-13 20:00:05,2,11,1,9,2016年10月份开始1年半来399481首次突破60天均线，按照过去的规律会有一波债券上涨行情，但现在又不太可能降息。我最近买入的16融创07（136624）、15海航债（127312）都涨了一波 
2018-04-13 19:51:13,1,2,0,10,本来想外盘涨了，没想到我大A股还是高开低走。不过本周除创业板外都是正收益，50稍强：
2018-04-13 09:46:55,0,8,0,10,$恒瑞医药(SH600276)$ 进口抗癌药免税，对恒瑞这样的药企是有点利空，但竞争并不是坏事，家电等行业不是在开放中成长起来的吗？
2018-04-13 06:15:27,0,2,0,4,其他详细指数及因子的估值及景气度见果仁网站：网页链接，用我的邀请码：AAHGQ注册后直接送一个月VIP
2018-04-12 15:31:17,0,3,0,9,今天又是近70%的个股下跌：医药、黄金等防御性板块领涨，次新、银行、煤炭、有色等领跌： 
2018-04-12 11:16:45,1,21,4,13,$信立泰(SZ002294)$&nbsp;今天信立泰终于大涨了，在医药股里连续五年扣非ROE大于25%的没几个，估值又这样低的只有信立泰一只了。
2018-04-12 05:43:38,0,1,2,3,其他详细指数及因子的估值及景气度见果仁网站：网页链接，用我的邀请码：AAHGQ注册后直接送一个月VIP
2018-04-11 15:25:29,0,2,2,13,今天涨的最好的不是50更不是神创，而是以中证1000为代表的小票，不过你方唱罢我登场，短期是很难预料的，还是要坚守好股，实盘六君子中的济川药业、海天味业今天都在盘中创出了历史新高：
2018-04-11 07:57:23,0,0,3,14,大票再次走强，有望风格再次转变。医药走强，而且绝对估值相对估值也尚可，有望成为今年的强指数其他详细指数及因子的估值及景气度见果仁网站：网页链接，用我的邀请码：AAHGQ注册后直接送一个月VIP
2018-04-10 15:35:45,1,18,2,13,399481少有的5连阳，破了M20，离开M60也只有一线之遥了。可以逐步加仓长久期的债券了。 
2018-04-10 15:22:29,2,6,0,5,今天继续延续最近几天的风格，大票的表现远超小票，虽然上证指数今天大涨了1.66%，但还是有一半不到点的股票是下跌的。看趋势有小转大的迹象：
2018-04-10 10:19:38,0,0,0,10,一过了回售期，今天13海航债（124286）连1分钱的成交都没有，买一只有97.9元，如果成交正好就像我说的跌了2%。不知道有没有人忘记卖出。
2018-04-10 06:57:24,0,2,3,5,其他详细指数及因子的估值及景气度见果仁网站：网页链接，用我的邀请码：AAHGQ注册后直接送一个月VIP
2018-04-10 06:50:40,6,19,0,28,美国看到中国发展那么快，如果换了我我也会不爽的。就好比我们家过去每天早饭是大饼油条，隔壁老王家是吃昨天剩下的泡饭；突然有一天老王不吃泡饭也不吃大饼油条，吃牛奶面包了。你说你看了会爽吗？总要找点老王的茬：隔壁老王小时候和我同桌的时候偷用过我的铅笔盒里的橡皮，连招呼都不打。
2018-04-09 15:56:14,1,2,0,4,今天还算比较平稳，50略涨的多一点。板块上海南板块因为博鳌会议大涨2.49%，家电以下跌2.08%领跌：
2018-04-09 07:35:03,0,8,0,23,$13海航债(SH124286)$&nbsp; 今天是286回售登记日的最后一天了，小散持有者务必卖出。
2018-04-05 06:57:15,0,4,0,5,其他详细指数及因子的估值及景气度见果仁网站：网页链接，用我的邀请码：AAHGQ注册后直接送一个月VIP
2018-04-04 17:17:01,0,5,3,12,188今天收盘99.047元，终于站上99元了，目标价99.7元。还能吃4个月的利息。同是海航债下周日到期的124286，下周五是最后一个交易日，务必在下周五前卖出，否则白白扣除6.6%*20%=1.32%的所得税，每次提醒大家每次总有人事后来问我怎么办？事后我还能怎么办？现在提醒大家下周千万别忘记卖出286！否则也太不把自己的钱当钱用了。
2018-04-04 17:08:42,1,16,0,5,今天50上涨，神创暴跌，是不是风格又要反转，目前还不好说：
2018-04-04 07:04:22,5,9,7,23,经过最近的下跌，50的PE在5年的百分位已经从接近100%下跌到74.78%，而PB的5年百分位更是下跌到54.84%了。再加上6月份的MSCI利好，50的反弹在积蓄力量之中。其他详细指数及因子的估值及景气度见果仁网站：网页链接，用我的邀请码：AAHGQ注册后直接送一个月VIP
2018-04-03 15:24:02,1,6,1,15,4月15日到期的13海航债（124286）净价已经到99.92元了，8月15日到期的13渤租债（112188）这几天天天涨，目标价向着286靠拢。
2018-04-03 15:14:29,0,10,1,10,受美股影响，只有猪肉等少数板块大涨，其他几乎都是下跌。但我觉得这还是暂时的：
2018-04-03 05:50:48,0,3,2,8,其他详细指数及因子的估值及景气度见果仁网站：网页链接，用我的邀请码：AAHGQ注册后直接送一个月VIP
2018-04-02 21:50:16,0,5,0,13,本来想市场的会因为中国的报复而低开，实际偏偏高开了，最后又没守住：
2018-03-31 12:29:43,8,26,9,31,最近的可转债打新除了江银转债和无锡转债分别亏损31.11和48.34外，还是盈利的比较多，其中中签率比较高的大族激光盈利319.94，玲珑轮胎盈利105.27。正是因为有新债是可能亏损的，感性的人才放弃了申购；正是因为聪明人选择性的申购可转债，所以才造成无脑申购的反而吃了大肉：
2018-03-30 15:34:40,1,4,2,12,50昨天表现了一天，今天又萎靡了。相反神创昨天歇了一天，今天又神气起来了。说到底还是场内资金不够，跷跷板变成常态： 
2018-03-30 06:54:57,0,2,0,10,其他详细指数及因子的估值及景气度见果仁网站：网页链接，用我的邀请码：AAHGQ注册后直接送一个月VIP
2018-03-29 15:19:51,1,4,1,12,今天难得50表现一次，创业板就走弱了，场内资金就是这些，在没什么增量资金的情况下，资金只能这样捉襟见肘了：
2018-03-29 07:07:05,0,1,3,6,其他详细指数及因子的估值及景气度见果仁网站：网页链接，用我的邀请码：AAHGQ注册后直接送一个月VIP
2018-03-28 21:24:14,0,1,0,21,乐视网见红，茅台因靓丽的年报领跌酿酒板块，相信这只是暂时的，狗有时会逆着牵狗人而行，但只要牵狗绳不断，总会跟上来的： 
2018-03-28 11:58:42,1,6,1,11,酿酒大跌，茅五洋跌幅都在5%以上，但亏的酒丢失的皇台酒业还是红盘
2018-03-28 11:38:28,2,20,1,17,今天酿酒板块领跌，酿酒中茅五洋跌幅居前三，茅台刚公布超预期的业绩，归母净利润比我估算的多了20亿。赚钱的越多跌的越多，而巨亏加上一堆利空的乐视网今天反而是红的。
2018-03-28 09:29:19,1,6,0,11,集合成交开盘182家红盘，2924家绿盘 
2018-03-28 07:25:57,1,9,0,12,2月9日大盘下跌，留下了一个从3227.71到3180.11的一个缺口，结果2月22日大盘高开，这个缺口从3227.71到3219.22这个8个点的缺口还是没补上，直到3月23日再次跳空低开，再次完美的躲开了这个缺口。按照缺口必补的理论，很有可能补上缺口后再次下跌，本来这两天有这个可能，结果昨天美股再次暴跌，估计最近的可能性不大了。缺口理论这种东西，是信则有不信则无的东西，大家都相信去补，就会影响大家的操作，结果十有八九就真的补上了；如果没人相信，可能也就补不上了。
2018-03-28 05:52:00,1,15,0,16,美股又是大跌，今天再次考验我大A股其他详细指数及因子的估值及景气度见果仁网站：网页链接，用我的邀请码：AAHGQ注册后直接送一个月VIP
2018-03-27 15:30:53,9,60,10,41,今天是妖股横行的一天，下跌股票仅有151只，不到5%，但都是中国平安、青岛海尔、建设银行、中国银行、招商银行、恒瑞医药、福耀玻璃、美的集团、格力电器、上汽集团、五粮液、华域汽车等标准的白马蓝筹股。三个著名的妖股保千里涨1.97%，獐子岛涨2.32%，乐视网如果不停牌大概率的也是上涨。 这就是中国股市的现实，抱怨股民不理智是没用的。 
2018-03-27 11:51:08,0,20,2,22,神创再次大涨，站上了年线，有人说下午要跌了。反正短期涨跌都有可能，我持有的三个神创利亚德、聚光科技、宋城演艺上午都涨了3%以上，宁可“上上下下的享受”也不想做短线了。
2018-03-27 09:24:36,0,18,1,49,昨天减仓的又一次准确的减在了低点。
2018-03-27 08:07:46,0,0,1,4,其他详细指数及因子的估值及景气度见果仁网站：网页链接，用我的邀请码：AAHGQ注册后直接送一个月VIP
2018-03-26 16:02:56,1,7,0,11,$恒瑞医药(SH600276)$&nbsp;今天盘中创出历史新高！
2018-03-26 15:19:33,0,12,2,14,今天两级分化严重，创业板指数涨3.16%，而50则跌了1.88%。相差5%都不止。上周五创业板大跌时专家们信誓旦旦的说创业板的反弹告一段落，接来下的反弹要看蓝筹了，今天的走势就狠狠的抽了一个大嘴巴。短期的任何预测都是不靠谱的。 
2018-03-26 06:16:23,0,2,4,15,今天又是一个腥风血雨之日，不过长期看不改我大A股向上的趋势。其他详细指数及因子的估值及景气度见果仁网站：网页链接，用我的邀请码：AAHGQ注册后直接送一个月VIP
2018-03-23 22:24:59,2,7,0,15,昨天小票还在和大盘怼，价值还在和趋势怼，今天在狂风暴雨下没有一个能幸免，显得空前的团结：
2018-03-23 05:04:40,2,2,3,10,美股暴跌，我大A股又要开启跟跌不跟涨的精神了。其他详细指数及因子的估值及景气度见果仁网站：网页链接，用我的邀请码：AAHGQ注册后直接送一个月VIP
2018-03-22 18:02:52,1,26,2,69,今天刚开通公众号，名称也是“持有封基”，主要内容是量化投资方面的原创文章，不太会用，请大家多多支持！
2018-03-22 17:17:41,0,3,0,16,今天几乎所有指数都是下跌的，但上涨股票数量和下跌股票数量正好是1:1，算术平均涨幅竟然还是正的0.23%，这说明从50到神创的相对大票都是跌的，而小票涨的多：
2018-03-22 06:17:25,0,0,2,4,其他详细指数及因子的估值及景气度见果仁网站：网页链接，用我的邀请码：AAHGQ注册后直接送一个月VIP
2018-03-21 15:16:41,0,5,0,6,平安的利好只在开盘，如果集合竞价买入，那么平安今天被套3.75%，整个大盘也被平安一起带下来了： 
2018-03-21 07:18:15,0,0,0,2,其他详细指数及因子的估值及景气度见果仁网站：网页链接，用我的邀请码：AAHGQ注册后直接送一个月VIP
2018-03-20 15:18:46,4,23,0,6,果然低开高走，结果还是神创涨的最多。今年各大指数无疑涨幅超过2%的，唯独神创涨了6.39%：
2018-03-20 07:03:45,0,2,0,9,其他详细指数及因子的估值及景气度见果仁网站：网页链接，用我的邀请码：AAHGQ注册后直接送一个月VIP
2018-03-19 15:18:51,0,11,0,10,今天50和创业板两头涨的多，中间反而涨的少。板块上保险、医疗领涨，煤炭、钢铁领跌：
2018-03-17 07:59:34,1,6,6,9,"一年来盈利的因子是：动态市盈率（23,47%）、市盈率（14.87%）、市净率（10.60%）、250日收益波动率（8.64%）、股息率（4.48%）等因子，全部是价值因子。其他详细指数及因子的估值及景气度见果仁网站：网页链接，用我的邀请码：AAHGQ注册后直接送一个月VIP"
2018-03-16 15:18:49,0,6,3,11,上证指数再次跌破年线，创业板大跌1.48%离开年线仅仅一步之遥：
2018-03-16 04:51:33,0,2,1,10,其他详细指数及因子的估值及景气度见果仁网站：网页链接，用我的邀请码：AAHGQ注册后直接送一个月VIP
2018-03-15 17:15:40,0,2,0,10,又是酿酒、家电领涨，次新领跌，小票纷纷走低：
2018-03-15 06:12:28,0,0,1,6,其他详细指数及因子的估值及景气度见果仁网站：网页链接，用我的邀请码：AAHGQ注册后直接送一个月VIP
2018-03-14 22:56:56,2,10,2,39,证监会给操纵股市的厦门北八道一张55亿的罚单，再加上妖股乐视网停牌，其他两个妖股獐子岛、保千里兔死狐悲大跌。孙宏斌退出乐视，估计停牌后又是几个跌停再次跌回原形。这次乐视被套的不能说上当了吧，都是心甘情愿的进去的。当时张家港行的非理性暴涨，只要稍微有点常识的都不会进去，银行的可比性很强，凭什么张家港行要享受那么高的估值？不是贪婪之心导致的又是什么？如果这帮人胆敢这样狂抄，在国外根本不用证监会来处罚，自然有做空的资金蜂拥而至，亏也要亏个几十万让你长长记性。
2018-03-14 06:20:33,0,2,4,7,其他详细指数及因子的估值及景气度见果仁网站：网页链接，用我的邀请码：AAHGQ注册后直接送一个月VIP
2018-03-13 15:25:05,0,10,1,18,怀疑今年植树节晚了一天，各大指数均下跌。但奇怪的是曾经一起连续跌停的三妖股乐视网、獐子岛、保千里今天突然全部涨停，妖魔鬼怪一起出笼了：
2018-03-13 13:55:16,1,15,0,17,乐视网、獐子岛、保千里患难三兄弟，当时一起跌停，今天乐视、獐子岛涨停，保千里也快涨停了。
2018-03-13 09:40:32,1,3,0,7,$农业银行(SH601288)$&nbsp;农行以大涨回答了看空者的疑问，港股昨天就大涨，今天继续大涨。还是港股先知先觉，A股后知后觉。
2018-03-13 06:50:45,0,3,2,7,小市值等因子走强，而市盈率等价投因子走弱。这也正常。其他详细指数及因子的估值及景气度见果仁网站：网页链接，用我的邀请码：AAHGQ注册后直接送一个月VIP
2018-03-12 17:03:03,4,21,1,13,上周神创站上年线后引发了小盘股一拥而上，不管是不是有业绩，就像去年大盘股一拥而上一样，真正的价值投资还远着呢：
2018-03-12 07:06:31,0,2,0,6,其他详细指数及因子的估值及景气度见果仁网站：网页链接，用我的邀请码：AAHGQ注册后直接送一个月VIP
2018-03-09 18:58:06,14,47,1,42,"刚发现，今天上证指数涨的太牛逼了，3307.17,和今年的起点2017年12月29日最后一个交易日的收盘点位分毫不差：3307.17.也就是说，今年上证指数折腾了2个多月，又回到起点了。"
2018-03-09 15:20:50,0,7,2,10,虽然上证指数和创业板指数今天都在年线上，但上证指数是1年多大部分时间都在年线上，最近一个多月下跌到年线下最近站上的年线；而创业板指数是2年多一直在年线下今天好不容易站上年线。上证指数就好比一个好学生一直成绩不错，最近一个月表现不好，这次又发挥正常了；而创业板就好比一个差生一直考试在60分下，这次突然及格了。给老师和家长带来的是惊喜。结果老师肯定表扬的是后者而不是前者，创业板站上年线后资金的蜂拥而至就是这种情况的表现。
2018-03-09 10:59:12,1,11,0,8,$创业板指(SZ399006)$&nbsp;创业板指数过年线了，2年多来多次站上年线又跌下来了，看看这次是否能站住？
2018-03-09 07:31:54,8,54,1,37,富士康是互联网企业？一个劳动密集型的企业怎么和互联网沾边。如果这样说，我造个纸板箱企业，这个纸板箱用在互联网产品，就是互联网概念股，用在人工智能产品，就是人工智能概念股，用在区块链产品，就是区块链概念股？
