发布时间,转发数,评论数,收藏数,点赞数,动态内容
2019-05-03 06:51:00,13,64,14,115,看完《晓说》的最后一期，屏幕上出现了“这期真没有下一期了”，还是感到很伤感，七年一期没拉下，在我这个年纪也是很少有的事情了，伴随着《晓说》的谈天说地，我们用了另一个视角去看世界，去思考人生。谢谢《晓说》，谢谢晓松
2019-05-02 08:38:26,288,432,962,426,符合巴菲特选股原则的在A股只有9只，10年每年ROE大于20%，我只是做了符合中国A股的“微整容”，把ROE改成扣非ROE，剔除了3年以下的次新股。
2019-05-01 17:59:15,2,36,3,100,终于在五一节完成了新书《聪明的定投》的二次校对，又增加了品种的选择等，看看能不能在这个月正式出版。
2019-05-01 12:34:58,43,68,72,80,91个指数的PE、PB、ROE、营业收入及利润增长和它们的相对值最新出炉，我先外出溜达一次，晚上给大家做详细分析：
2019-04-30 15:20:53,2,15,5,40,本月最后一天上证指数果然上涨了0.52%，非常接近30年长假最后一个交易日平均值的0.42%，结束了罕见的六连阴。本月除了上证50上涨3.76%，沪深300上涨1.05%外其他宽基指数均下跌。本月四个月大小强弱分明，分别是大-小-小-大。1、4两个月大票强，2、3两个月小票强。结果大票重沪深300今年上涨29.98%，小票的创业板指数上涨29.85%，都没超过30%，几乎打个平手。
2019-04-30 09:43:33,3,11,1,44,除了极个别公司未出年报季报外，3601家A股的2018年年报和2019年季报已经出齐，即将推出简评，如果让我用八个字来概括，那就是：年报触底，季报反弹。
2019-04-30 07:22:55,2,23,4,42,一般长假前的最后一个交易日和长假后的第一个交易日容易红盘。因为最后一个交易日，卖出后也不能提出现金了，投资者失去了卖出的动力。而且一般月底往往会有做业绩的冲动。而长假后第一个交易日，是因为赚钱效应在长假同学朋友聚会中发酵传播，再加上长假期间赌徒长期不赌手痒，第一天冲进赌场的概率大。
2019-04-30 06:12:20,6,16,1,24,大家早！昨天对面的纳指和标普500继续创出历史新高，道指离开历史新高也只有一线之遥了。上证指数六连阴，按照我的统计，在2014年后仅有一次发生在2018年的5月30日，结果也是当月最后一个交易日2018年5月31日大涨了1.78%。历史虽然不会简单的重复，但复制去年5月底的行情的可能性还是很大的。
2019-04-29 18:37:40,1,9,0,8,$格力电器(SZ000651)$ 季报是不是也和昨天的年报一样要到晚上9点发？
2019-04-29 16:52:34,5,21,5,26,今天绩优的大票和绩差的小票分化特别严重，上证50上涨1.61%，中证1000下跌3.63%，差异超过5个点。今年的沪深300指数涨29.55%，而创业板指数涨29.20%，沪深300指数再次赶上创业板指数，连续3年大强小弱今年很有可能延续。
2019-04-28 19:50:51,1,20,0,21,$格力电器(SZ000651)$ 格力年报，千呼万唤不出来
2019-04-26 20:02:00,12,14,4,32,本周连跌5天，跌幅最大的指数是中证500，跌幅为6.92%，跌幅最小的创业板指数也跌了3.38%，值得注意的是本周中位数跌幅为7.83%，超过所有的宽基指数的跌幅，说明在本周比中证1000更小的1800个股票的跌幅大于前1800个股票：
2019-04-26 06:24:11,2,16,0,10,$微软(MSFT)$ 微软昨天又创历史新高了，带动了纳指也创了历史新高
2019-04-25 16:06:40,2,6,1,19,今天真正实现了雷军的预言了：在风口上，猪也会飞起来。所有的板块只有猪肉是红的。今天这样一跌，本月的中证500、中证1000、创业板都变成阴线了。而只有猪肉指数在本月大涨了14.1%。
2019-04-25 15:12:24,1,19,0,46,刚下飞机到烟台，好冷啊，打开手机看了一下行情更冷了。
2019-04-25 05:29:54,4,30,1,37,$贵州茅台(SH600519)$ 即使茅台站上了1000元，PE-TTM也只有32。每次靓丽的业绩会消化价格的上涨。
2019-04-24 16:07:27,3,10,1,27,今天的走势恰恰和昨天相反，昨天是只有一个50是红的，今天是只有一个50是绿的。短期要捕捉市场的变化是难上加难：
2019-04-24 05:00:10,2,16,1,38,大家早！今天有五个新可转债上市，接盘资金估计会捉襟见肘，先等等，到收盘前再看。
2019-04-23 15:22:02,1,4,1,22,今天指数只有50是微红的，茅台继续创出981.22元的历史新高，再涨2.57%就站上1000元了。北上资金大量流出近60亿，指数下跌找绩优股避险也符合常理。
2019-04-23 08:10:37,4,15,1,46,大家早！昨天大跌，今天估计惯性低开，收盘如何只有天知道。明天有5只新可转债上市交易，也是很少见的。昨天晚上又有万华等一大批公司公布年报季报，还有一周多年报季报公布结束了。粗粗看了看确实经济放缓的迹象在年报季报中有反映，但就看大家的解读了，现在市场主流声音是解读成要触底反弹。
2019-04-22 19:26:34,0,15,0,13,$万华化学(SH600309)$ 年报几点钟出啊？
2019-04-22 17:03:05,21,107,6,100,刚刚一个朋友打电话给我，说看到周末股指期货利好，今天开盘就满仓了证券B，没想到又被套住了。他说他也知道自己操盘能力差，就做一把赚一票准备洗手不干了，没想到又被套住了。是否会解套我不知道，即使牛市继续，我估计他能有微利就出局了。没有自己的交易系统，完全凭感觉的很少能做好股票。
2019-04-22 15:52:25,1,0,0,13,今天只有猪肉、石油等少数板块是红的，周五大涨的家电领跌。
2019-04-21 07:38:24,5,69,0,65,来杭州的讲课，一大早就在西湖边走走成了来杭州的必选项了，似乎清晨不来西湖边走走是一种浪费
2019-04-20 04:08:23,17,95,0,236,大家早！失去才感到是最珍贵的。
2019-04-12 15:17:28,2,7,1,37,今天上证指数虽然没收红，但缩量走出一个V字还是不错的。经过调整后周末如果没大的利空，下周还是看好：
2019-04-11 18:58:57,3,12,1,24,一天一个样，昨天强势的酿酒、家电，今天变成领跌的。再次劝大家别追强势板块强势股：
2019-04-11 10:10:38,0,6,2,12,$11海航02(SH122071)$ 0715月24日付息，个人持有每100元面值要付6.2*20%=1.84元利息，这两天已经先走了，免得在这一个月多的时间内由于种种原因下跌导致进退两难。
2019-04-11 07:02:13,6,24,3,17,$国泰国证食品饮料行业指数(F160222)$ 大家早！跟我定投国泰食品/160222的注意，昨天账面出现天量亏损是因为涨的太多导致高折，过两天就会正常，请大家无虑。
2019-04-11 06:09:38,1,16,1,38,大家早！昨天格力封板打开多次，182亿的天量成交额也说明了多空双方分歧严重。继续观察今天的表现。茅台的上涨，留下了两个巨大的跳空缺口，什么时候站上1000元成为大家的猜测。两个标志性的白马股吸引了众多的眼光。
2019-04-10 21:53:48,0,7,0,17,$格力电器(SZ000651)$ 今天港资净买入10亿
2019-04-10 15:31:18,12,31,7,29,指数没怎么涨，但酿酒、家电、汽车、医药等绩优股指数领涨，今年绩优股指数880835已经大涨了45.70%，战胜了各大宽基指数，牛市紧紧抱住绩优股不放是最好的策略：
2019-04-10 14:33:17,9,46,0,64,昆山锦溪，中学同学农家乐，近半个世纪的同学情，回想起当年在农村的集体生活。
2019-04-10 07:10:44,13,54,2,48,大家早！今天格力继续上涨，但要第二个板有点难。今天有个明泰转债可以申购，申购代码783677。
2019-04-09 15:29:44,6,27,3,23,今天格力复牌后带领家电板块大涨，昨天大涨的化工、钢铁等走弱。跷跷板现像明显，一天一个样，追风格很容易被套住在高高的山岗上：
2019-04-09 08:48:58,17,107,1,22,北京的安保人员真多，地铁里电梯口，地铁车厢门口，公交车上，还有地铁里时不时查证件的。我在想将来人脸识别成熟后，每个人的行踪都被实时监控，这些人工检查的还需要吗？
2019-04-09 05:08:38,6,60,3,80,大家早！格力复牌，虽然我也重仓格力，但两个涨停可能性极小，补涨一个板可能性比较大。今天可以申购一个新的可转债，鼎新转债，申购代码：754876
2019-04-08 15:23:28,1,4,0,19,化工、酿酒等绩优股领涨。今年绩优股指数上涨41.50%，亏损股指数上涨38.08%，活跃股指数上涨23.91%。绩优从长期看还是上涨的动力：
2019-04-08 08:57:58,3,14,0,64,今天去北京电视台做一个基金节目
2019-04-08 08:31:28,20,102,16,69,关于可转债打新的资金利用率，可以这样估算，打中后需要1000元，就算赚100元，就是10%，平均持有时间大概26天自然日。如果你在26日里确定能赚10%的，那就别打了，再说打新可转债还是有那么一点点风险。
2019-04-08 06:54:23,4,31,8,49,大家早！周一效应大概率重现，今天又有两只可转债可以申购，申购代码：072538、783611
2019-04-07 04:57:58,7,35,0,33,大家早！一早去北京
2019-04-06 08:43:45,0,14,0,33,大家早！昨天晚上刚从苏州回来，明天一早就要去北京。
2019-04-04 21:12:43,4,33,1,59,$贵州茅台(SH600519)$ 其他白酒如果是白马，那么茅台是白龙马；其他白酒如果是在赚钱，那么茅台是在印钱，今年有望站上1000。强烈希望茅台拆股，1股拆成100股，也让广大散户享受茅台的红利。
2019-04-04 21:02:24,4,3,2,40,今天上证指数强势摸到3254，所有的宽基指数都是上涨的，但中位数下跌了0.06%，说明今天的小票是比较弱的，而中证1000都涨了0.37%，也就是说1800只头部股票整体上涨，而尾部的另外1800只股票整体是下跌的：
2019-04-04 10:15:12,4,24,1,47,$N伊力转(SH110055)$ 开盘125卖出中的2签，赚了两个250，一天500一个月算20个交易日也有1万了，哈哈。
2019-04-04 06:09:29,10,35,9,55,今天有个G三峡EB1可以申购，对应的正股是长江电力，可交换债是大股东发行的，和可转债不同，可转债是上市公司发行的，有强烈的转股动机，哪怕正股跌了都要想尽办法的调低转股价，而可交换债则没有转股的动机，就是一个找利息低的便宜的资金。再说转股价高达18.8，而昨天收盘16.89。虽然破发的可能性很小，但占用资金太大感觉在牛市不太合算，我打算放弃申购了。
2019-04-03 10:22:34,13,40,5,29,$青农商行(SZ002958)$ 因为开盘已经开板了，再次封板无脑卖出。赚了3064.79元，金拱门要吃死你了，蛮好。
2019-04-03 07:25:01,24,89,9,67,大家早！今天除了申购两只新股，还可以申购两只新可转债：参林转债，申购代码：754233，未来转债，申购代码：072631。目前都折价。
2019-04-02 17:04:32,2,13,1,34,前期强势的猪肉、酿酒、家电今天又领跌了。视乎周一魔咒又来了：每周一大涨，然后3-4天调整。但如果你觉得这个规律是真的，很有可能就像上周一一样大跌一次。没找规律的时候似乎有规律，要用规律了似乎又没规律了。市场永远是你的老师：
2019-04-02 06:40:20,13,59,2,41,大家早！经过连续两天的大涨，高位调整在所难免，绑紧安全带。
2019-04-01 18:14:10,9,27,2,38,经过今天的大涨，上证50、创业板两个重要指数完全收复了去年的失地，和2017年12月31日的收盘相比，上证50还涨了1.13%，创业板涨了0.47%，而上证指数还跌4.14%，沪深300还跌1.41，中证500还跌7.89%，中证1000还跌12.53%，但很多优质股票如贵州茅台等都已经创出了历史新高。
2019-04-01 17:24:10,1,4,0,33,今天虽然是愚人节，但大盘一点都没愚人，上周一虽然中断了周一效应，但本周开始又恢复了周一效应。地铁里看股票行情的开始多起来了，牛市还在继续发酵中，没有做不到，只有想不到。 
2019-04-01 08:15:06,1,9,7,27,按照天天基金的数据，扣除不到5万份，由于异常赎回导致收益率巨高无比的富荣价值精选，我定投的招商中证白酒（161725）以1季度57.08%在全部4719只基金中排名第一！
2019-03-31 17:36:46,4,24,0,14,下午去家乐福买食品，自助结账时手机卡了，我试了试人脸识别结账，还是非常快的。我在想我在支付宝里没设置过人类识别付账啊。我猜想是支付宝的手机号关联到身份证号码，在关联出身份证上的照片和人脸匹配。但似乎应该征得用户同意才开通吧？我自己倒是无所谓，也没说明隐私，现在真的是没什么隐私了，你走到哪里到处都是摄像头，可以智能跟踪你，哈哈。
2019-03-31 11:30:52,1,23,0,45,基本吃素，腌笃鲜，南瓜，小豌豆
2019-03-29 15:34:20,6,32,0,46,$上证指数(SH000001)$&nbsp;北上资金也是墙头草，跟屁虫，前几天还巨额资金流出，今天一涨，117亿多资金流入了。
2019-03-29 15:30:40,2,9,1,24,就在技术派说要跌破什么什么线时，大盘就偏偏给你个艳阳天看看，受昨天年报利好的影响，茅台再次创出了866.68的历史新高。证券、保险、酿酒等板块领涨，唯一下跌的版块就是工业大麻：
2019-03-29 09:28:08,0,6,0,12,$贵州茅台(SH600519)$ 又一个历史新高诞生了，今天最终新高会多少钱呢？
2019-03-28 20:20:14,0,6,0,15,$贵州茅台(SH600519)$&nbsp;茅台全年归母净利润352亿，前期预估340.93亿
2019-03-28 17:57:42,0,5,1,13,$贵州茅台(SH600519)$ 今天北上资金净买入茅台3亿多，是在赌年报吗？
2019-03-28 16:51:35,0,11,0,22,$上证指数(SH000001)$ 2994.94，刚跌破3000，就要：尔救救市，救市？
2019-03-28 15:49:12,1,8,2,15,$贵州茅台(SH600519)$&nbsp;今天晚上看茅台年报，是不是已经有人提前知道了？今天茅台逆势走强，差了5分钱要再创历史新高了。明天是1季度最后一个交易日，也有可能茅台利好带着白酒继续拉升。
2019-03-28 15:25:04,10,17,4,25,今天蛮有意思，领跌的工业大麻指数暴跌6.85%，昨天暴涨8.15%，很多工业大麻概念股如福日电子、信邦制药、康贝恩等都是昨天涨停今天跌停。炒作概念股两天里天地板，大麻的作用如此体现在股市里也是比较少见的。本周中位数跌幅高达4.91%，超过了跌幅最大的中证500的跌幅4.48%。而本周跌幅最少的是上证50，下跌了2.20%。小票转弱，大票开始抗跌。今天的茅台盘中差了5分钱差点继续创出历史新高：
2019-03-27 15:20:10,5,17,2,31,今天医药、酿酒等绩优板块大涨，前一段时间炒作的概念股领跌。价值不会缺席只会迟到，即使是北上资金的撤退都改变不了价值：
2019-03-27 11:27:38,1,7,0,45,$万华化学(SH600309)$&nbsp;有价值的早涨晚涨早晚会涨，垃圾股早跌晚跌早晚会跌！ 
2019-03-26 19:21:02,4,9,7,21,@富国价值ETF&nbsp; 送的《追寻价值之路》开篇是国信证券经济研究所所长杨均明写的：价值投资唯一重要指标：持续稳定的高ROE。唯一重要、持续稳定，都是非常准确的描述，通篇的内容我都非常有共鸣，谢谢@富国价值ETF ！
2019-03-26 17:58:45,3,6,3,51,我们不要把北上资金看做是铁板一块。昨天茅台净卖出6.89亿，今天净买入1.12亿；昨天平安净卖出11.19亿，今天净买入1.67亿，昨天格力净卖出3.34亿，今天净买入1.90亿。有人说这是伪北上。其实这种数据只能是一个参考，股票长期上涨的动力还是业绩。
2019-03-26 15:31:02,3,10,5,28,今天的下跌感觉正好是昨天的互补，昨天跌多了的版块今天少跌点，昨天跌少了的版块今天多跌点。结果两天下来大家都跌了3%-4%，追涨杀跌的就跌的更多了：
2019-03-26 13:42:15,0,4,0,18,@富国价值ETF&nbsp; 《追求价值之路》一书已经收到，多谢了！
2019-03-26 12:05:12,5,35,0,34,老电脑时间实在是太长了，这次换了一台新的。找了个人帮我把原来的数据都导出来。结果早上数据导入后宏不能用，反复调试无果，找了技术大拿远程支持了半天也不行。突然想到还没上网呢？在家里网络24小时在线没感觉。一直存在的东西从来不会觉得珍惜的，只有失去了才会觉得它的重要。
2019-03-25 15:49:56,0,19,0,29,$上证指数(SH000001)$ 今天北上资金净卖出104亿，是大盘大跌的重要推手，真是成也萧何败也萧何
2019-03-25 11:17:17,7,23,0,13,$深成指B(SZ150023)$ 竟然没跌停，也就是在A股
2019-03-22 05:25:19,2,34,0,72,一早出发赶上第一班地铁去合肥，但愿今天红盘！
2019-03-21 17:09:09,1,3,0,16,今天中证500、国证2000、中证全指等都创出今年新高小票强势趋势不变，酿酒、银行、家电等绩优板块领跌： 
2019-03-21 11:56:12,22,140,5,96,据说新发的睿远基金已经过百亿了，我来泼点冷水，历史上新基金筹集过百亿的，哪个表现好的?一个都没有。
2019-03-20 15:18:45,2,11,0,16,今天又是证券、亏损股等领涨，猪肉领跌，不过双汇涨的不错，感觉双汇不能算在猪肉板块中，前期猪肉大涨双汇滞涨，今天猪肉大跌双汇大涨： 
2019-03-20 10:07:27,1,10,0,12,$中证白酒(SZ399997)$&nbsp;白酒才调整了一天又开始拉了。
2019-03-19 15:29:33,2,9,3,31,昨天白酒领涨，今天领跌，倒也正常，现在的风格一天一个样，你想去追只有被反复打耳光。持有不动等机会吧，今年不是把猪都吹到天上去了吗？
2019-03-18 15:21:26,4,17,5,40,被我上周五猜中了，今天白马蓝筹开始表现，茅台突破800元，表现最好的中证白酒指数今天大涨8.19%，今年累计大涨了49.77%，也是我去年定投的招商白酒跟踪的指数：
2019-03-18 10:47:33,2,13,0,24,$贵州茅台(SH600519)$&nbsp;哈哈，我去烧了个饭，回来一看茅台就上800了！
2019-03-18 10:17:28,6,30,2,41,$中证白酒(SZ399997)$&nbsp;中证白酒今年已经超过46%了，定投的招商中证白酒也是硕果累累，去年跌多的时候吃足筹码，今年大丰收。
2019-03-18 08:11:56,47,239,73,136,很多人都喜欢做T，做网格交易。从成功率来看，确实很高，10次做T，成功9次，关键是这失败的1次，可能损失的比成功9次的总和还要多。
2019-03-18 07:51:51,0,3,0,28,$上证指数(SH000001)$&nbsp;年报开始进入密集发布区，业绩将成为股价上涨的推手，风向可能转白马蓝筹。
2019-03-15 17:19:50,5,55,8,51,$双汇发展(SZ000895)$&nbsp;加上中报分红，股息率高达5.73%，总共融资包括增发255.72亿，历史累计分红291.21亿，加上这次分红18.15亿，一共分红309.36亿，超过融资的120%。每年虽然增长不多，但光股息率就超过纯银行，如果你用存银行的心态持有双汇，那么心态就会非常平和，至于有机会高抛，那是给我们的奖励。
2019-03-15 15:27:49,14,30,1,15,上周强势股今天以下跌1.92%领跌，公共交通、工程机械、酒店餐饮、聚氨酯、家用电器等领涨。感觉风格再次转到蓝筹白马上了。北向资金沪市净买入23.89亿，而深市才4.68亿：
2019-03-14 18:24:35,1,5,1,14,今天猪肉股等前期强势股继续领跌，只有酿酒、保险等绩优股板块是红的：
2019-03-14 06:27:54,1,25,0,17,一早起来准备回国了。感觉越南的河内和胡志明市有点类似中国的北京和上海的关系。
2019-03-13 23:36:54,1,8,0,23,今天最大的利好是早上开不出的笔记本电脑晚上竟然恢复正常了。
2019-03-13 21:34:00,1,5,0,17,华统、立华、温氏、新希望、正邦等几个猪肉股票的跌停带来了今天的调整。创业板昨天刚刚收复去年的失地就暴跌。有人说创业板昨天就有了今天暴跌的迹象，我是不相信这些事后诸葛亮，事前猪一样的鬼话。创业板太强了肯定会跌，至于今天跌完全是靠蒙的。跌完后是否继续跌，还是明天就反弹，我没这个本事猜中：
2019-03-13 14:53:48,0,14,0,34,$上证指数(SH000001)$ 早上我带出来的笔记本电脑开不出了，我就有一种不好的预感。
2019-03-12 23:36:58,5,16,1,33,创业板今年已经涨了41.81%了，在宽基指数中第一个完全收复了去年的失地。
2019-03-12 11:11:12,4,14,0,25,$双汇发展(SZ000895)$&nbsp;终于来了，该来的总会来的。
2019-03-11 20:12:26,4,5,2,17,大盘还是很强势，创业板指数再创反弹新高，量能有所缩减，北上资金逆势流出15亿。估计会在3000点一线展开拉锯战：
2019-03-11 11:16:14,5,35,0,52,$上证指数(SH000001)$ 看样子出国魔咒继续有效[呲牙]
2019-03-11 07:18:55,1,11,4,41,上周五因为两份看空报告引起的血案，其实理性的想，不是因为这两份报告，也会因为其他原因导致的调整的。即使是真的大牛市，也不可能天天涨不调整的，而且过去的经验告诉我们，越是调整来的晚，调整的幅度会越是大。牛市暴跌是常态，只有暴跌，吓走一批人，才会涨的更好。真的牛市，也不会让所有人都赚钱的，一定是有一部分人在牛市也要亏钱。。
2019-03-10 07:59:34,4,17,0,42,#给新股民的建议# 不敢给建议，绝大部分新股民是不会听你的所谓建议的。他们来股市就是希望快速的赚钱，越快越好。中信证券和招商证券两份说了实话的报告导致了周五本来就要调整的股市的下跌，很多新股民就吵吵嚷嚷的说要退出中信证券和招商证券。浮躁之心略见一斑。
2019-03-08 23:23:49,18,23,3,26,很多人都在诟病两个看空报告引起的血案，其实每次大牛市都会有暴跌，我前几天说了07年牛市里的227、530，还被不少人指责。说牛市刚来就说暴跌，说看不懂你在说什么。该来的总会来的。
2019-03-08 19:28:31,0,28,0,39,刚下飞机到了河内，网速慢的感觉回到几年前。
2019-03-08 15:00:44,0,18,0,51,$上证指数(SH000001)$ 哎，怪我飞机还没起飞，是我不好。
2019-03-08 11:40:36,1,19,1,14,$中国人保(SH601319)$ 有意思，跌停，翻红，再跌停。
2019-03-08 10:28:36,1,11,2,15,$济川药业(SH600566)$ 不容易啊，逆势而上。价值不会缺席只会迟到。
2019-03-08 10:10:52,3,18,0,9,$创业板指(SZ399006)$ 竟然红了
2019-03-08 06:21:30,7,38,2,108,垃圾股恶炒，中国人保的研报被罕见的成为“卖出”，各地查出银行违规资金入市，昨天白马大幅度下跌，北上资金开始流出，美股昨天也下跌。所有这一切的利空预示着该来的调整还是会来的。不过唯一可以对冲的消息是：我今天出国一周。
2019-03-07 17:09:26,12,32,1,22,今天3元以下的60个股票全部都是红的，估计广场舞大妈进场了。
2019-03-07 15:30:01,6,28,3,13,今天白马暴跌，低价小盘股大涨。上证指数继续五连阳。
2019-03-06 15:17:18,45,136,50,137,下午大盘已经开始下跌了，很多人都在卖出，甚至纷纷打听有什么利空。而大盘奋勇一击，竟然站上了3100，再次创出万亿天量。这让我想起了2007年大牛市中的几次暴跌，227是春节长期刚过的第二个交易日，上证指数暴跌8.84%，千股跌停；530是半夜鸡叫，也是千股跌停，聪明人每次割肉每次割后后悔再追进去。最后遇到暴跌后习惯认为抗几天会涨的，谁知道偏偏把你套在高高的山岗上。07年大牛市不少散户亏损就是这么来的。将来的牛转熊也一定会在大部分人想不到的时候完成的：
2019-03-06 12:57:24,1,11,0,9,$上证指数(SH000001)$&nbsp;今天估计会创新的天量成交额
2019-03-05 15:15:44,4,24,2,22,大盘还是非常强，创业板大涨3.51%，超过了昨天的最高点，唯一下跌的宽指是上证50，也就是微跌0.13%。只要下跌一点就迎来疯狂的资金。其实即使是牛市，还是跌跌更健康。现在这样一点调整的迹象都看不到，说不定哪天突然来个暴跌：
2019-03-05 09:01:52,3,35,0,24,降税了，今天又要大涨了。
2019-03-04 18:08:10,1,27,1,28,$贵州茅台(SH600519)$&nbsp;茅台今天虽然冲上历史新高回落最后收阴，但北上资金又是净买入了5.61亿，是整个市场净买入最多的。茅台这样下去都要被外资买走了。
2019-03-04 15:18:32,6,23,3,34,今天大盘开盘就站上3000点一直维持到收盘，四渡赤水成功。不过盘中冲高回落，形成了技术派人士口中所谓的“射击之星”，按照他们的说法是见顶的信号。我的态度是不可全信不可不信，很有可能调整后再次上攻。
2019-03-04 13:05:14,1,24,0,17,$上证指数(SH000001)$&nbsp;说不定今天就上3100，专家的预测都在纷纷改口。
2019-03-04 11:18:18,6,48,0,41,疯了疯了，人有多大胆，股有多大量 
2019-03-04 10:21:34,2,22,1,28,$上证指数(SH000001)$&nbsp;涨的实在太快了，一点回调都没有，最后不知道又是哪些人站在高高的山岗上唱歌了。
2019-03-04 09:31:42,0,8,0,9,$贵州茅台(SH600519)$&nbsp;茅台也创历史新高了
2019-03-04 09:26:49,0,3,0,24,$上证指数(SH000001)$&nbsp;果然跳空高开，四渡赤水站上3000点！
2019-03-04 07:18:26,46,63,69,25,网传第一批科创板56家准上市家企业名单，其中上海18家，北京16家，杭州5家，深圳4家，广州、无锡各2家：
2019-03-03 13:57:58,9,57,0,14,全球第一星巴克门口排长队，真是逼格高还是装逼格?
