发布时间,转发数,评论数,收藏数,点赞数,动态内容
2017-04-12 06:50:49,0,6,1,0,昨天次新因子强烈反弹，平均涨幅为2.37%，其次还是低价因子，平均为1.79%。小市值因子依然反弹无力，40因子中排名仅为25，尚未到平均值。每元所有者权益、市净率等价值投资因子表现依然强劲，分别为1.25%、1.16%。垫底的为销售毛利率，其一周、一月、一季为-0.79%、-3.94%、-3.15%，排名分别为39、37、39，仅仅比小市值、次新略好，其原因百思不得其解。至于低价因子在最近表现如此之好，我分析一方面由于在低价股里有一批类似银行股这样价值投资的股票，再加上散户喜好的小票股、高送转、次新等都受到刘士余点名批评，而低价是唯一没被刘士余点名的因子了，所以由于挤出效应导致低价因子如此走强。不过好在主力媒体还没关注到这个现象。“悄悄地进庄，打枪的不要”，一旦被主流媒体关注上了，我估计再疯狂几天也要开始步小市值、次新、高送转的后尘了。
2017-04-11 15:14:21,5,18,7,0,按照策略去掉了小市值因子，今天也跑赢了大盘了。
2017-04-11 05:43:53,3,11,6,0,昨天次新、小市值因子继续垫底，值得注意的是反弹因子（60天涨幅）大跌2.32%，成为40因子中倒数第二，说明趋势在继续加强并没出现反弹。昨天排名第一的因子还是低价因子（收盘价），前100名平均涨0.71%，其次是每元所有者权益，每元所有者利润、市净率、每元资产总计等价值因子。
2017-04-10 18:28:24,12,46,21,0,今天大盘跌的还不多，但小市值、次新、高送转等因子大跌，中午回到上海，下了决心全部换成没有小市值的因子了。截止到收盘，今年大盘涨5.34%，实盘亏了7.10%，跑输12.44%。主要原因还是小市值。去年考小市值跑赢大盘，即使去年的12月大盘大跌4.50%，实盘收益率发而是1.31%，光12月就跑赢了5.81%，今年1月小市值大盘1.79%，实盘因小市值跌5.86%，当时也想过全面放弃小市值，但基于过去历史上小市值因子多次反转，就坚持了，果然2月份大盘涨2.61%，实盘涨了3.68%，继续依靠小市值因子跑赢了大盘。但到了3月份小市值再次严重跑输，大盘只有跌了0.59%，但实盘则大跌4.76%。复牌今年的策略，再次证明了近因效应的影响，不管策略也好，因子也好，还是操作也好，会受到过去成功因素的影响。甚至因为壳资源的价值下降已经意识到这个问题了，早就放弃了纯小市值，但还是把小市值当做味精加到其他策略里去了，直到受到严重影响。从2007年2016十年是靠量化策略取得了十倍的收益，但过去只能代表过去。狠狠心把策略里的小市值因子全部去掉了。也有可能明天小市值就反弹，被反复打脸的事情不能完全避免，但每次受挫，每次经过复盘都在成长。一个季度在10年的历史上还是短暂的，将来也不能保证不再次受挫，当相信长期来看只要坚持不断修正策略，总会有一个光明的未来。
2017-04-08 11:53:43,0,3,1,0,雪球北京club准备中
2017-04-08 05:08:28,2,3,9,0,昨天表现最好的是每元所有者权益，表现最差的依然是次新因子。低价因子在最近受投资者青睐，在最近一个季度中排名第一，最近一周、一月均排名第二。除此之外，所有者权益类的和所有者净利类的因子走强，市场偏好明显转向价值投资类因子，小盘因子、次新因子在一段时间内表现出色后偃旗息鼓，将来是否会转强不好说。
2017-04-08 04:33:33,1,4,0,0,3301几次就是无功而返，不知道是刻意还是一个魔咒。
2017-04-07 13:44:09,0,1,0,0,"我在今天雪球实盘大赛#摇一摇PK#日收益比赛中,凭借$持有封基的实盘(SP1005282)$，战胜了@tg1980，抽到了1元交易券，你也来参与吧，雪球App访问：网页链接"
2017-04-07 13:42:34,0,0,0,0,"我在今天雪球实盘大赛#摇一摇PK#日收益比赛中,凭借$持有封基的实盘(SP1005282)$，战胜了@何时止何时休，抽到了1元交易券，你也来参与吧，雪球App访问：网页链接"
2017-04-07 09:13:44,0,15,0,0,挑了一大早从上海到北京的飞机，就是怕因为流量原因误点，结果广播里说因为上海大雨不能起飞。
2017-04-07 03:56:52,1,10,3,0,昨天大盘依然惯性反弹，最强因子还是低价因子，甚至在最近一周、一月、一季三个指标中均排名第一。小市值、次新等昨天反弹也不错。
2017-04-06 15:22:22,4,8,2,0,好几个公司新进的新宝股份，没折价还锁定一年，想不明白如果是这样看好新宝股份，那还不如干脆市价买进算了。定增基金看来要步老封基的后尘了。折价的定增没了。
2017-04-06 15:11:58,1,1,0,0,大盘虽然翻红，但感觉后劲不足，3301估计不会一蹴而就。
2017-04-06 07:56:16,5,40,11,1,"14天瑞03债券/124977现在的税前年化收益率（YTM）已经快要突破9%了，目前是8.99%,10月15回售，回售前净价大概率接近100元。"
2017-04-06 06:32:28,1,4,2,0,昨天40因子受雄安利好影响全部为正收益，最高的是收盘价和总市值，分别为2.51%和2.33%，表现最差的销售毛利率因子昨天也涨了1.54%。最近一周、一月、一季度表现最好的是收盘价，这说明低价依然是中国股民偏好的因子。
2017-04-05 15:16:12,0,6,1,0,雄安大利好，实盘今天一口气涨了2.61%，新的季度，新的希望，上个季度量化受挫，希望这个季度能赶上。
2017-04-05 09:40:50,0,1,0,0,"我在今天雪球实盘大赛#摇一摇PK#日收益比赛中,凭借$持有封基的实盘(SP1005282)$，战胜了@心常平，抽到了1元交易券，你也来参与吧，雪球App访问：网页链接"
2017-04-05 09:38:42,0,0,0,0,"我在今天雪球实盘大赛#摇一摇PK#日收益比赛中,凭借$持有封基的实盘(SP1005282)$，战胜了@value6，抽到了1元交易券，你也来参与吧，雪球App访问：网页链接"
2017-04-05 09:38:30,0,0,0,0,"我在今天雪球实盘大赛#摇一摇PK#日收益比赛中,凭借$持有封基的实盘(SP1005282)$，战胜了@Shiny9182，抽到了1元交易券，你也来参与吧，雪球App访问：网页链接"
2017-04-05 09:31:43,0,0,0,0,"我在今天雪球实盘大赛#摇一摇PK#日收益比赛中,凭借$持有封基的实盘(SP1005282)$，战胜了@snailgaara，抽到了1元交易券，你也来参与吧，雪球App访问：网页链接"
2017-03-31 20:35:23,0,13,1,0,今天大盘略微反弹了点，实盘也算有点安慰。这个月严重跑输指数，按照历史数据统计，4月份是历史上10多年表现最好的月份，希望下个月能追回来。
2017-03-31 05:52:18,4,14,5,0,昨天指数因为中石油、工行等几个大盘股尾部拉升而下跌不多，但个股下跌惨烈，41个策略无一幸免，跌的最少的EV_EBITDA也下跌0.62%，小市值策略跌3.52%，小市值策略在近一天、一周、一个月、一个季度四项指标几乎全部是最后一名，只是近一周比次新跌的略少而已。不过近一周、一月、一季度三项指标均在前10名的依然还有收盘价、每元净利润、每元未分配利润、EV_EBITDA四项因子。
2017-03-30 15:53:14,0,30,1,0,今天所有股票算术平均跌幅是2.33%，远远高于昨天的0.98%。看回测历史，比这更惨的还有的是，后来也都跑赢了。坚持。
2017-03-30 06:29:40,1,12,14,0,昨天次新因子大跌5.12%，累计5个交易日已经下跌了7.07%，但在最近一个月中依然以5.74%的收益率高居第一。昨天最好的因子竟然是低价因子，前100只股票平均涨了0.92%，不过从最近一周、一个月、一个季度来看，最好的因子应该是每元未分配利润，其对应的收益率是0.27%、0.89%、6.76%，是唯一这三项指标均是正收益的因子，而且昨天也是难得的正收益。市场对该因子的喜好，估计和期待年报高分配行情有关。
2017-03-29 17:46:01,4,32,1,0,这个月严重跑输，闭门思过中。
2017-03-29 17:30:18,1,4,1,0,九泰3月22日申购了个广东正业科技，收盘价42.7元，申购成本42.8。溢价0.23%，还锁定1年。而且我仔细查了查，最近一个月里定增基金已经没有申购过一个打折的定增股票了。这样下去定增基金也快废了。不过如果真的是这样对中国股市不是坏事，因为定增猛于虎，而且历史上定增的金额要高出IPO一个数量级，如果刘士余真的把打折的定增这头虎关进笼子里，定增基金废就废了，对中国股市有大利好。
2017-03-29 09:42:51,0,0,0,0,"我在今天雪球实盘大赛#摇一摇PK#日收益比赛中,凭借$持有封基的实盘(SP1005282)$，战胜了@天下孤星，抽到了2元交易券，你也来参与吧，雪球App访问：网页链接"
2017-03-29 09:42:39,0,0,0,0,"我在今天雪球实盘大赛#摇一摇PK#日收益比赛中,凭借$持有封基的实盘(SP1005282)$，战胜了@YH股票88，抽到了1元交易券，你也来参与吧，雪球App访问：网页链接"
2017-03-29 08:30:34,1,8,2,0,昨天大盘调整，前期最强的次新因子暴跌2.86%，为41因子的最大跌幅，而比较戏剧性的是前期跌跌不休的小市值因子，在昨天反而成为41因子中唯一上涨的因子，前100名平均涨幅0.11%，是次新资金撤出后进入小市值了？还是其他原因，一天的涨跌当然不能说明什么，我们拭目以待。
2017-03-28 15:31:26,1,12,2,0,从昨天换到今天，主要是考虑到分散风险，平均持有了多策略的20只股票，虽然今天是严重跑输，但还是相信概率，相信量化。
2017-03-28 07:23:28,1,6,9,0,昨天历史排名第一的总市值因子继续垫底，而次新因子（上市时间）成为昨天唯一涨的因子而继续走强。
2017-03-27 15:30:03,0,3,1,0,大盘依然不温不火，次新还是一枝独秀。
2017-03-27 09:30:27,0,0,0,0,龙建股份停牌一周后高开3.11%复牌
2017-03-25 08:26:52,3,10,7,0,昨天次新因子（上市天数）再次走强，其次是高管20天增持次数，其他昨天表现较好的因子在近一个月中除了每元未分配利润外均出现负收益，这也反应了市场的多变。不过次新因子不仅在昨天排名第一，而且最近一个月、一个季度均排名第一。很多人都担心次新因子将出现反转，但往往市场就是这样，你越担心，就越涨给你看，只有大家都看好时，将孕育这下一次暴跌。
2017-03-24 15:12:57,0,8,0,0,大盘还是非常强大，小市值因子看不出转好的迹象，次新因子也看不出见顶的迹象。本周还跑输了大盘，虽然本月还勉强跑赢。
2017-03-24 08:06:08,6,12,23,0,以下数据是用果仁平台测试的，时间是从2007年开始到最近一个交易日。测试条件：每20个交易日换一次，平均持有排名条件前100个股票，剔除涨跌停和日交易额小于1000万的股票。昨天表现最好的前三名是历史收益率靠后的资本公积季增、所有者权益季增、股东权益季增三个因子，这三个因子在近一个月表现不错。最差的是上市天数（即次新），该因子历史10年收益率是负收益，但本周、本季均排名第一。过去的数据只能代表过去，但有参考意义。
2017-03-23 15:07:32,1,9,0,0,下午开盘也不知道什么原因就开始下跌了，有人说是受B股影响。那么大的一个A股还会受B股影响？好在最后基本都收回来了，实盘今天还略有盈利。
2017-03-23 09:51:36,0,0,0,0,"我在今天雪球实盘大赛#摇一摇PK#日收益比赛中,凭借$持有封基的实盘(SP1005282)$，战胜了@BruceLee123，抽到了1元交易券，你也来参与吧，雪球App访问：网页链接"
2017-03-23 09:50:41,0,0,0,0,"我在今天雪球实盘大赛#摇一摇PK#日收益比赛中,凭借$持有封基的实盘(SP1005282)$，战胜了@青春的泥沼，抽到了1元交易券，你也来参与吧，雪球App访问：网页链接"
2017-03-23 08:51:19,3,4,2,0,听取了大家的意见，把原来的仓位分成总仓位和定增仓位，总仓位是所有股票所占比例的仓位，定增仓位仅仅是锁定期定增股票的仓位，一旦定增股到期就移除定增仓位，数据以公司公告和季报、年报为准。另外增加了每天的成交额，便于大家操作：
2017-03-22 17:13:37,8,22,1,0,受美股影响，大盘终于跌了一下，不过也正常，整体还是看好后市。
2017-03-21 17:14:20,3,6,2,0,增加了华夏磐泰和浙商鼎盈：
2017-03-21 17:09:24,0,7,0,0,经过一天的上上下下，结果实盘赚的钱还无法显示在百分比上。江西长运收盘后公告，预盈变预亏，明天只能听天由命了。
2017-03-21 10:20:10,0,0,0,0,"我在今天雪球实盘大赛#摇一摇PK#日收益比赛中,凭借$持有封基的实盘(SP1005282)$，战胜了@地狱王天堂奴，抽到了1元交易券，你也来参与吧，雪球App访问：网页链接"
2017-03-21 10:19:32,0,0,0,0,"我在今天雪球实盘大赛#摇一摇PK#日收益比赛中,凭借$持有封基的实盘(SP1005282)$，战胜了@小小馄饨，抽到了3元交易券，你也来参与吧，雪球App访问：网页链接"
2017-03-20 15:12:55,0,0,1,0,神华成了神话了，大比例分红带着煤炭股一路走红，不过高开低走的居多。其实神华有钱大比例分红和煤炭也没什么关系。虽然煤炭整体在改善。只不过多了一个炒作的理由。就像当年奥巴马当选，澳柯玛涨停一样的道理。只要沾边的都会涨。
2017-03-20 14:46:30,0,7,1,0,399481一路下滑，加息呼声越来越高，可转债每天有创历史新低。不知道为什么总有人喜欢死扛。即使要买债券，也不能买超过一年的长债，124977加上利息最近还是赚的，但长债就惨了。
2017-03-20 09:50:01,0,0,0,0,"我在今天雪球实盘大赛#摇一摇PK#日收益比赛中,凭借$持有封基的实盘(SP1005282)$，战胜了@超人不会累，你也来参与吧，雪球App访问：网页链接"
2017-03-20 09:49:47,0,0,0,0,"我在今天雪球实盘大赛#摇一摇PK#日收益比赛中,凭借$持有封基的实盘(SP1005282)$，战胜了@雨的印记86，抽到了1元交易券，你也来参与吧，雪球App访问：网页链接"
2017-03-20 09:49:35,0,0,0,0,"我在今天雪球实盘大赛#摇一摇PK#日收益比赛中,凭借$持有封基的实盘(SP1005282)$，战胜了@我的前男友，抽到了1元交易券，你也来参与吧，雪球App访问：网页链接"
2017-03-20 09:42:32,0,10,1,0,中国神华因大比例分红而涨停，带着煤炭股一起大涨。其实是没什么道理的，其他煤炭股会这样大比例分红吗？市场其实就是找个理由在炒作。所以才会有奥巴马当选，澳柯玛涨停这样的笑话。
2017-03-17 17:37:48,3,7,1,0,排名第一的015本周大涨了1.28%，跑赢了所有的指数和几乎所有有成交量的定增基金，模型看来还是有点用的。
2017-03-17 17:32:44,0,6,1,0,今天实盘盘中已经出坑，可惜晚节不保。不过小市值策略的东华测试、经纬电材等今天都大涨了6-7个点。看来小市值还是死灰复燃。
2017-03-17 11:23:18,0,0,0,0,"我在今天雪球实盘大赛#摇一摇PK#日收益比赛中,凭借$持有封基的实盘(SP1005282)$，战胜了@chenzjut，抽到了1元交易券，你也来参与吧，雪球App访问：网页链接"
2017-03-17 07:17:43,4,26,38,0,昨天那么好的大盘，蓝标，格力等转债还在继续创新低，真为这些拿可转债的人感觉不值。可转债肯定有价值，而且肯定会跌到一个底部开始反弹，但坚持不跌破100元不入市。光大等一批公司现在受制于刘士余新政改发可转债，导致扩容巨大，而昨天美联储的加息也预告着中国即将启动加息周期。所有这一切对可转债都是利空的。但物极必反，我们在不远的将来肯定会迎来可转债再次在100元下见底，然后又是一个轰轰烈烈的牛市，唯一的问题是，第二个@阿土哥a &nbsp;的10倍中转在哪来？
2017-03-16 21:44:46,1,17,1,1,张家港行又一次涨停。很多人惊呼：我买到了假的银行股了。其实张家港行真的不是银行股，所有的银行股在系统中的银行的行都是输入h的，唯独张家港行，你输入zjgh是找不到的，只有输入zjgx才能找到。这不是分明告诉大家，张家港行不是一家银行，而是一个特别行（xing）的股票吗？
2017-03-16 15:08:01,1,13,0,0,受美联储加息影响，我猜低开是大概率的，即使高开，也会低走或者平走。可偏偏大盘高开高走，一副牛市不回头的样子。好在实盘还是继续满仓。
2017-03-16 09:36:10,0,0,0,0,"我在今天雪球实盘大赛#摇一摇PK#日收益比赛中,凭借$持有封基的实盘(SP1005282)$，战胜了@skylin008，抽到了1元交易券，你也来参与吧，雪球App访问：网页链接"
2017-03-16 09:35:50,0,0,0,0,"我在今天雪球实盘大赛#摇一摇PK#日收益比赛中,凭借$持有封基的实盘(SP1005282)$，战胜了@ywb淡泊，抽到了1元交易券，你也来参与吧，雪球App访问：网页链接"
2017-03-15 22:08:00,0,1,0,0,飞机从上海到沈阳，晚点了近5个小时。大盘也是折腾了半天，又一次差不多回到原点。
2017-03-15 16:00:26,6,38,8,0,去沈阳的飞机晚了四个多小时，在中国，除了早上第一班飞机，几乎没有不晚点的飞机。但我出国那么多次，就没遇到过晚点的飞机。根据我的一个空管朋友说，主要是两个原因。一是军方占用了大量的航道，即使不用你民航也不能用。而是我们国家的航道管理至今沿用前苏联的水平切割的方法，不像美国等把航道还垂直切割，所以即使美国天上的飞机比我们多的多也没遇到什么流量问题。不知道是真是假。雪球上人才济济，是否有内行请教一下？
2017-03-14 16:01:56,0,5,0,0,虽然上证指数勉强收红，但其他指数均跌了，创业板跌了0.65%，股票也是跌多涨少。
2017-03-14 09:37:37,0,0,0,0,"我在今天雪球实盘大赛#摇一摇PK#日收益比赛中,凭借$持有封基的实盘(SP1005282)$，战胜了@培黄根，抽到了1元交易券，你也来参与吧，雪球App访问：网页链接"
2017-03-14 06:45:17,1,17,2,0,江泉债回售已经实质性违约，再加上美国大概率加息，除了持有类似124977这样的短债，不建议其他长债和垃圾债。
2017-03-13 15:07:30,1,15,0,0,就在大部分人都不看好时，大盘在9:45探底后走出了一个漂亮的钩子，连回调都不带一点。所以预测是一件吃力不讨好的事情。每天总有人猜对，但没人会永远猜对。
2017-03-12 14:53:07,13,36,21,1,好久没关注转债了，最近转债怎么了？蓝标转债、海印转债、辉丰转债、洪涛转债、格力转债、14宝钢EB、16凤凰EB等在周五都创下新低了？大盘走的也算还好，虽然有见顶迹象，难道是转债有先行功能？还是仅仅是价值回归？
2017-03-12 13:45:53,5,23,37,0,最近一段时间买水果不是在水果店也不是在哪个网上，而是小区的群里。每次都是有人在微信群里贴品种和价格，每个人写自己需要的品种和数量并接龙下去，周六他们根据最新的清单直接发货并通知我们去小区的某个人家这里去取。有点相当于C-M模式，**的缩短了供应链，确保水果质量是最新鲜的，而且能**降低销售成本，因为是小区熟人圈子，很多手续都省略了，甚至我们取货也只在本子上签个字，回头再在微信上付款。
2017-03-10 15:12:30,1,1,0,0,前几名总是101、015、103等
2017-03-10 15:08:12,0,5,2,0,又是尾盘下跌，下周还有股指期货交割，看趋势下周凶多吉少。不过实盘还是靠着易成新能和大连圣亚的大涨勉强红盘。
2017-03-10 09:34:30,0,0,0,0,"我在今天雪球实盘大赛#摇一摇PK#日收益比赛中,凭借$持有封基的实盘(SP1005282)$，战胜了@80yuer，抽到了1元交易券，你也来参与吧，雪球App访问：网页链接"
2017-03-10 09:34:02,0,0,0,0,"我在今天雪球实盘大赛#摇一摇PK#日收益比赛中,凭借$持有封基的实盘(SP1005282)$，战胜了@sunbeam，抽到了1元交易券，你也来参与吧，雪球App访问：网页链接"
2017-03-10 09:33:44,0,0,0,0,"我在今天雪球实盘大赛#摇一摇PK#日收益比赛中,凭借$持有封基的实盘(SP1005282)$，战胜了@光彩影，你也来参与吧，雪球App访问：网页链接"
2017-03-10 09:33:26,0,0,1,0,"我在今天雪球实盘大赛#摇一摇PK#日收益比赛中,凭借$持有封基的实盘(SP1005282)$，战胜了@管好你的手，抽到了1元交易券，你也来参与吧，雪球App访问：网页链接"
2017-03-10 09:33:13,0,0,0,0,"我在今天雪球实盘大赛#摇一摇PK#日收益比赛中,凭借$持有封基的实盘(SP1005282)$，战胜了@银行螺丝钉，抽到了1元交易券，你也来参与吧，雪球App访问：网页链接"
2017-03-09 19:05:08,0,12,0,0,大盘再次调整，实盘也再次快要出坑时再次回落。虽然如此，还是不想择时而坚持满仓轮动策略。
2017-03-08 16:59:45,0,8,5,0,今天大小票均进入调整，实盘虽然也跟随着调整，但整体跌了才0.28%。仔细核对了一下，周一换出的6个股票今天平均跌1.43，而换入的6个股票平均才跌了0.03%，虽然这才是一天的数据不能说明什么，但满仓轮动的精髓就是不断的换入将来相对涨幅大的股票。日积月累将是非常客观的。
2017-03-07 15:28:13,2,13,2,0,大盘还是非常顽强的翻红了，实盘也朝着出坑的方向又前进了一步。
2017-03-06 15:14:13,0,16,5,0,模拟盘从上次2月6日换股以来到今天收盘，中证1000涨3.96%，10个股票平均涨6.91%。新换入股票如下，到下个月再换了。
2017-03-06 14:29:30,0,10,0,0,我刚刚调整了雪球组合 $聚宝盆4号(ZH757074)$  的仓位。按照策略每月换股一次
2017-03-06 12:32:22,0,0,0,0,"我在今天雪球实盘大赛#摇一摇PK#日收益比赛中,凭借$持有封基的实盘(SP1005282)$，战胜了@卤味，抽到了1元交易券，你也来参与吧，雪球App访问：网页链接"
2017-03-06 12:32:08,0,0,0,0,"我在今天雪球实盘大赛#摇一摇PK#日收益比赛中,凭借$持有封基的实盘(SP1005282)$，战胜了@伊春雪，抽到了1元交易券，你也来参与吧，雪球App访问：网页链接"
2017-03-06 12:31:30,0,0,0,0,"我在今天雪球实盘大赛#摇一摇PK#日收益比赛中,凭借$持有封基的实盘(SP1005282)$，战胜了@自由老木头，抽到了1元交易券，你也来参与吧，雪球App访问：网页链接"
2017-03-03 18:22:18,0,11,1,0,虽然大盘跌了，但实盘中春兰股份再次大涨5.64%，使得整体还是涨了0.50%。下周一是换股日，新的因子，新的策略使得3月份信心更足了。
2017-03-03 11:02:24,0,0,1,0,"我在今天雪球实盘大赛#摇一摇PK#日收益比赛中,凭借$持有封基的实盘(SP1005282)$，战胜了@jesse凯子，抽到了1元交易券，你也来参与吧，雪球App访问：网页链接"
2017-03-03 11:01:38,0,0,0,0,"我在今天雪球实盘大赛#摇一摇PK#日收益比赛中,凭借$持有封基的实盘(SP1005282)$，战胜了@Rayzhu2013a，抽到了1元交易券，你也来参与吧，雪球App访问：网页链接"
2017-03-03 11:01:20,0,0,0,0,"我在今天雪球实盘大赛#摇一摇PK#日收益比赛中,凭借$持有封基的实盘(SP1005282)$，战胜了@拾取后绑定，抽到了1元交易券，你也来参与吧，雪球App访问：网页链接"
2017-03-03 00:00:01,0,3,1,0,我的雪球组合$聚宝盆4号(ZH757074)$月报出炉，快来看看我的组合战绩吧。网页链接
2017-03-02 20:21:08,0,10,0,0,外围大涨，我们高开低走。也不知道什么原因，实盘持有的明星电力开盘后就被拉到涨停，虽然后来被打开涨停板，但收盘依然大涨了5.19%，虽然整体还是跌了，但仅仅跌了0.28%。
2017-03-02 06:37:46,2,13,3,0,顺丰就是好公司非好股票的典型，我们的炒家们非要把一个好公司炒成坏股票，将来再跌出机会。
2017-03-01 16:35:54,0,6,1,0,3月份第一天，大盘继续温和放量反弹，实盘也总算涨了点。
2017-02-28 18:51:41,1,3,1,0,2月份最后一个交易日结束了，实盘整个2月份涨3.68%，刚好和中证1000持平。
2017-02-27 21:21:06,0,8,0,0,这周在台湾，出来的时候忘记租wifi的设备了，不能及时回答网友的问题，抱歉！
2017-02-24 15:11:18,0,11,0,0,虽然今天遇到了易成新能的黑天鹅，但也遇到了春兰股份的惊喜，另外瑞丰光电、同大股份、大连圣亚等都大涨了2%左右，最后实盘还是涨了0.91%，本周实盘大涨3.32%，本月大涨了5.43%，均大幅度跑赢了各项指数，1月16日的大坑填的还有0.75%了。
2017-02-24 13:17:14,0,0,0,0,"我在今天雪球实盘大赛#摇一摇PK#日收益比赛中,凭借$持有封基的实盘(SP1005282)$，战胜了@挪威阿森林，抽到了1元交易券，你也来参与吧，雪球App访问：网页链接"
2017-02-24 13:17:05,0,0,0,0,"我在今天雪球实盘大赛#摇一摇PK#日收益比赛中,凭借$持有封基的实盘(SP1005282)$，战胜了@阿鼻仔，抽到了1元交易券，你也来参与吧，雪球App访问：网页链接"
2017-02-24 13:16:43,0,0,0,0,"我在今天雪球实盘大赛#摇一摇PK#日收益比赛中,凭借$持有封基的实盘(SP1005282)$，战胜了@leroyzhang，抽到了1元交易券，你也来参与吧，雪球App访问：网页链接"
